{"attestationHash":"e13ab0e1de2b1c8f3cacf3b249fb81171835289861e3ee403853f75f15db6244","generatedAt":"2026-02-02T00:00:00.000Z","heads":{"invoiceBundle":{"attestationHash":"2765b1ead490916306ad21970d39a7e6aea4b36ba9c8df8a3cf6496eb3caa6e3","embeddedPath":"payload/invoice_bundle","manifestHash":"febcf35ea9ab257558711f98da2bef28c157acdec242d803c1b75e5190cd9e53"}},"kind":"ClosePack.v1","manifestHash":"8ffdb2819db247b7693314dddca3977c96e50da6241ba1aa7c458f7b093085a7","schemaVersion":"BundleHeadAttestation.v1","scope":{"invoiceId":"invoice_fixture_1"},"signature":"HJtwu4SjCm1GVsyY9rq19TpvL/Vj0ZGWTlu7j5vxEeoGfBZVkR4V+qj5XbomLYGp6OhcCOrdbWfHlOJ2u561Dg==","signedAt":"2026-02-02T00:00:00.000Z","signerKeyId":"key_9ed38005b42d9364601ffab3","tenantId":"tenant_fixture"}
