{"attestationHash":"fe34d78f459e4112281cb3d98931e5ca51cff47a378e0917cdda36ebfdac5aeb","generatedAt":"2026-02-02T00:00:00.000Z","heads":{"invoiceBundle":{"attestationHash":"2765b1ead490916306ad21970d39a7e6aea4b36ba9c8df8a3cf6496eb3caa6e3","embeddedPath":"payload/invoice_bundle","manifestHash":"febcf35ea9ab257558711f98da2bef28c157acdec242d803c1b75e5190cd9e53"}},"kind":"ClosePack.v1","manifestHash":"bb7b59531a8a4bac27de528772e2059d4d53325145b0706b769f0eb323a77c28","schemaVersion":"BundleHeadAttestation.v1","scope":{"invoiceId":"invoice_fixture_1"},"signature":"wCdLlxUggb6OaBIfiO5O+lTKTwLUjqeNZjPwuyGkuLGAEwhfONQo/OUJyW0k93C0IxitKLI4RnB9p8efafLRBA==","signedAt":"2026-02-02T00:00:00.000Z","signerKeyId":"key_9ed38005b42d9364601ffab3","tenantId":"tenant_fixture"}
