{"attestationHash":"ad167671cd2d6cb4f56496f1a36d7ab7f5dad220cf18d404df7606a0d2123189","generatedAt":"2026-02-02T00:00:00.000Z","heads":{"governance":{"global":{"lastChainHash":"92b4cd341b48c58fc8dffea3d6bbc0f62f979965d9271339ced8b8f7bf258e60","lastEventId":"evt_gov_serverA_registered"},"tenant":{"lastChainHash":null,"lastEventId":null}},"month":{"lastChainHash":"23b7b7926048ee85a471fb9a058cdd133417c620fa4f840da6c3a480a537002d","lastEventId":"evt_month_close_requested"}},"kind":"MonthProofBundle.v1","manifestHash":"3da51828dca44e2f7cdd27ddd60e54f89f84b69d92af378969a74091780d4fbb","schemaVersion":"BundleHeadAttestation.v1","scope":{"basis":"settledAt","period":"2026-01"},"signature":"j8LtjxTaGJabyAuDPbYt/QpYLsau98koNdmBRGe5hyvJx9/P5NUSFv5Z7WYY79GZxAiKaZFCP3pvc+YDa0OEBw==","signedAt":"2026-02-02T00:00:00.000Z","signerKeyId":"key_9ed38005b42d9364601ffab3","tenantId":"tenant_fixture"}
