{"attestationHash":"c70b62f9e28ac91fa07073c802495d1801921c0d01924a2538f981a7e18f8d5b","generatedAt":"2026-02-02T00:00:00.000Z","heads":{"governance":{"global":{"lastChainHash":"92b4cd341b48c58fc8dffea3d6bbc0f62f979965d9271339ced8b8f7bf258e60","lastEventId":"evt_gov_serverA_registered"},"tenant":{"lastChainHash":null,"lastEventId":null}},"job":{"lastChainHash":"e698a6e1d597a4be85d31bdac90a34a66b9d43886ad43f59c0cc4e77efdde78d","lastEventId":"evt_job_created"}},"kind":"JobProofBundle.v1","manifestHash":"6775ce8a23cb436fdd6e2809bf79d2b1ac05f76a820094342b0cc68f425ef9d8","schemaVersion":"BundleHeadAttestation.v1","scope":{"jobId":"job_fixture_1"},"signature":"WqNZduwUjQcSlBF7PnWoRyaBuyeD73eevVB3jz58Fa3xd6J+HT6ivilEdUMaATF4QxA+s2p4sMhJYrHeqKB3CQ==","signedAt":"2026-02-02T00:00:00.000Z","signerKeyId":"key_9ed38005b42d9364601ffab3","tenantId":"tenant_fixture"}
