{"attestationHash":"bb3b88301cb5df728436775909bc81ec96428eab30081d42a967914051461604","generatedAt":"2026-02-02T00:00:00.000Z","heads":{"monthProof":{"attestationHash":"ad167671cd2d6cb4f56496f1a36d7ab7f5dad220cf18d404df7606a0d2123189","manifestHash":"3da51828dca44e2f7cdd27ddd60e54f89f84b69d92af378969a74091780d4fbb"}},"kind":"FinancePackBundle.v1","manifestHash":"caac3b07c68f05f6821d8e88e8ef39081d7ae07453a540ae5d1536d7ce197099","schemaVersion":"BundleHeadAttestation.v1","scope":{"period":"2026-01"},"signature":"RmEvFf29IvX6fZZdlTvwO7ruJPeFcUDNpFeTl7yv6XI5tHkaTlPdm16IPDdXobIYvGly9UnBqWBZTmALpuiPCQ==","signedAt":"2026-02-02T00:00:00.000Z","signerKeyId":"key_9ed38005b42d9364601ffab3","tenantId":"tenant_fixture"}
