{"attestationHash":"e649e5bc52d397e99cb0b6a246a8e242a5f8a6e4934c1c31f60188737096e6b9","generatedAt":"2026-02-02T00:00:00.000Z","heads":{"jobProof":{"attestationHash":"c70b62f9e28ac91fa07073c802495d1801921c0d01924a2538f981a7e18f8d5b","manifestHash":"6775ce8a23cb436fdd6e2809bf79d2b1ac05f76a820094342b0cc68f425ef9d8"}},"kind":"InvoiceBundle.v1","manifestHash":"6f92e6a5efb2ea94be27f66c28a12b87446d6d5d992a2787c35943e2880f7fed","schemaVersion":"BundleHeadAttestation.v1","scope":{"invoiceId":"invoice_fixture_unsigned_matrix"},"signature":"02l1uGmSxoeDjyKxpLI0eXeZm72Tcx5iKM4iNg8Ei1gvE+jsGiMfBFgdgY0tdIIMstE9b2I5sUxCszt3GSa3Cg==","signedAt":"2026-02-02T00:00:00.000Z","signerKeyId":"key_9ed38005b42d9364601ffab3","tenantId":"tenant_fixture"}
