{"attestationHash":"ad954731321d843a37e84101702b7fb7fcb584f7b286c8757b761bea272cc3c5","generatedAt":"2026-02-02T00:00:00.000Z","heads":{"monthProof":{"attestationHash":"ad167671cd2d6cb4f56496f1a36d7ab7f5dad220cf18d404df7606a0d2123189","manifestHash":"3da51828dca44e2f7cdd27ddd60e54f89f84b69d92af378969a74091780d4fbb"}},"kind":"FinancePackBundle.v1","manifestHash":"103a264eeaf4a29ce9ce113de2c543b6a9fda2bae02def437f3f40b0fd3ef539","schemaVersion":"BundleHeadAttestation.v1","scope":{"period":"2026-01"},"signature":"IrWoK58ft9I1mtn1NZDcq7LVMiRftFgFryUNI9VctnFIocbv5MjAayVNe3gHfZtBHp2DHXop3Mx5y0KY3H+sBA==","signedAt":"2026-02-02T00:00:00.000Z","signerKeyId":"key_9ed38005b42d9364601ffab3","tenantId":"tenant_fixture"}
