{"attestationHash":"8b15727b811d865a5187aa9da01066a3271dd6465f6c18e6c8d1b59c0a955755","generatedAt":"2026-02-02T00:00:00.000Z","heads":{"jobProof":{"attestationHash":"c70b62f9e28ac91fa07073c802495d1801921c0d01924a2538f981a7e18f8d5b","manifestHash":"6775ce8a23cb436fdd6e2809bf79d2b1ac05f76a820094342b0cc68f425ef9d8"}},"kind":"InvoiceBundle.v1","manifestHash":"7b348ab1bb5a84f7899b718a08bd7827bb6b7b213b97ef74142061270fb2233a","schemaVersion":"BundleHeadAttestation.v1","scope":{"invoiceId":"invoice_fixture_1"},"signature":"GlfGo5NvhA07IfuL/mqQotiSoZes9gtvy+HF/eL1cY/Kim46aamjw/gmGzODcN0zvZ4cuzYW4UlpjZn1SUR0CQ==","signedAt":"2026-02-02T00:00:00.000Z","signerKeyId":"key_9ed38005b42d9364601ffab3","tenantId":"tenant_fixture"}
